{"$id":"https://model-benchmark.invalid/schemas/functional-v1-dry-launch-qualification-v1.schema.json","$schema":"https://json-schema.org/draft/2020-12/schema","additionalProperties":false,"properties":{"catalog_validation":{"additionalProperties":false,"properties":{"catalog_document_sha256":{"pattern":"^sha256:[0-9a-f]{64}$","type":"string"},"manifests":{"items":{"additionalProperties":false,"properties":{"base_url":{"const":"https://opencode.ai/zen/go/v1"},"catalog_input_usd_per_million_tokens":{"pattern":"^[0-9]+(?:\\.[0-9]+)?$","type":"string"},"catalog_output_usd_per_million_tokens":{"pattern":"^[0-9]+(?:\\.[0-9]+)?$","type":"string"},"effective_from_utc":{"pattern":"^20[0-9]{2}-[01][0-9]-[0-3][0-9]T[0-2][0-9]:[0-5][0-9]:[0-5][0-9](?:\\.[0-9]{1,6})?Z$","type":"string"},"effective_until_utc":{"pattern":"^20[0-9]{2}-[01][0-9]-[0-3][0-9]T[0-2][0-9]:[0-5][0-9]:[0-5][0-9](?:\\.[0-9]{1,6})?Z$","type":"string"},"live_route_status":{"maximum":599,"minimum":100,"type":"integer"},"manifest":{"enum":["functional-v1-hy3.yaml","functional-v1-manifest.yaml","functional-v1-mimo-v2.5.yaml","functional-v1-minimax-m3.yaml"],"type":"string"},"manifest_identity":{"pattern":"^functional-v1-manifest:sha256:[0-9a-f]{64}$","type":"string"},"model":{"enum":["deepseek-v4-flash","hy3","mimo-v2.5","minimax-m3"],"type":"string"},"pricing_identity":{"pattern":"^pricing-record:sha256:[0-9a-f]{64}$","type":"string"},"resolved_manifest_identity":{"pattern":"^resolved-v1-manifest:sha256:[0-9a-f]{64}$","type":"string"},"source_yaml_sha256":{"pattern":"^sha256:[0-9a-f]{64}$","type":"string"},"status":{"const":"passed"}},"required":["base_url","catalog_input_usd_per_million_tokens","catalog_output_usd_per_million_tokens","effective_from_utc","effective_until_utc","live_route_status","manifest","manifest_identity","model","pricing_identity","resolved_manifest_identity","source_yaml_sha256","status"],"type":"object"},"maxItems":4,"minItems":4,"type":"array","uniqueItems":true},"provider_id":{"const":"opencode-go"},"retrieved_at_utc":{"pattern":"^20[0-9]{2}-[01][0-9]-[0-3][0-9]T[0-2][0-9]:[0-5][0-9]:[0-5][0-9](?:\\.[0-9]{1,6})?Z$","type":"string"},"schema_version":{"const":1},"source_url":{"const":"https://models.dev/api.json"},"status":{"const":"passed"}},"required":["catalog_document_sha256","manifests","provider_id","retrieved_at_utc","schema_version","source_url","status"],"type":"object"},"cells":{"items":{"additionalProperties":false,"properties":{"cell_id":{"pattern":"^(0[1-9]|1[0-6])-[a-z0-9-]+-(omp|opencode|hermes|raw-api)$","type":"string"},"condition":{"enum":["omp","opencode","hermes","raw-api"],"type":"string"},"disposition":{"const":"valid_completed"},"evidence_valid":{"const":true},"lifecycle":{"additionalProperties":false,"properties":{"bundle_sealed":{"const":true},"cleanup_complete":{"const":true},"condition_exited":{"const":true},"condition_started":{"const":true},"proxy_request_observed":{"const":true},"trusted_submission_capture":{"const":true},"verifier_completed":{"const":true}},"required":["bundle_sealed","cleanup_complete","condition_exited","condition_started","proxy_request_observed","trusted_submission_capture","verifier_completed"],"type":"object"},"provider_requests":{"minimum":1,"type":"integer"},"provider_tokens":{"minimum":0,"type":"integer"},"reason_code":{"pattern":"^[a-z0-9]+(?:-[a-z0-9]+)*$","type":"string"},"result_bundle_identity":{"pattern":"^result-bundle:sha256:[0-9a-f]{64}$","type":"string"},"scenario":{"enum":["python-sales-by-genre","spring-petvalidator-whitespace","angular-reading-time","react-author-filter"],"type":"string"},"terminal_phase":{"const":"verification"}},"required":["cell_id","condition","disposition","evidence_valid","lifecycle","provider_requests","provider_tokens","reason_code","result_bundle_identity","scenario","terminal_phase"],"type":"object"},"maxItems":16,"minItems":16,"type":"array"},"execution":{"additionalProperties":false,"properties":{"completed_at_utc":{"pattern":"^20[0-9]{2}-[01][0-9]-[0-3][0-9]T[0-2][0-9]:[0-5][0-9]:[0-5][0-9](?:\\.[0-9]{1,6})?Z$","type":"string"},"manifest_identity":{"pattern":"^functional-v1-manifest:sha256:[0-9a-f]{64}$","type":"string"},"manifest_source_sha256":{"pattern":"^sha256:[0-9a-f]{64}$","type":"string"},"resolved_manifest_identity":{"pattern":"^resolved-v1-manifest:sha256:[0-9a-f]{64}$","type":"string"},"runtime_tree_digest":{"pattern":"^artifact:sha256:[0-9a-f]{64}$","type":"string"},"started_at_utc":{"pattern":"^20[0-9]{2}-[01][0-9]-[0-3][0-9]T[0-2][0-9]:[0-5][0-9]:[0-5][0-9](?:\\.[0-9]{1,6})?Z$","type":"string"}},"required":["completed_at_utc","manifest_identity","manifest_source_sha256","resolved_manifest_identity","runtime_tree_digest","started_at_utc"],"type":"object"},"local_provider":{"additionalProperties":false,"properties":{"external_cost_usd":{"const":"0"},"external_provider_requests":{"const":0},"implementation_sha256":{"pattern":"^sha256:[0-9a-f]{64}$","type":"string"},"local_provider_requests":{"minimum":16,"type":"integer"},"network":{"const":"loopback-only"},"response_sha256":{"pattern":"^sha256:[0-9a-f]{64}$","type":"string"},"substitution":{"const":"loopback-deterministic-v1"}},"required":["external_cost_usd","external_provider_requests","implementation_sha256","local_provider_requests","network","response_sha256","substitution"],"type":"object"},"network":{"additionalProperties":false,"properties":{"after_execution":{"const":"down"},"before_execution":{"const":"down"},"external_egress_observed":{"const":0},"proxy_network":{"const":"internal"},"restored":{"const":"up"},"worker_uplink":{"pattern":"^[a-zA-Z0-9_.-]+$","type":"string"}},"required":["after_execution","before_execution","external_egress_observed","proxy_network","restored","worker_uplink"],"type":"object"},"schema":{"additionalProperties":false,"properties":{"canonicalization_sha256":{"pattern":"^canonicalization:sha256:[0-9a-f]{64}$","type":"string"},"canonicalization_version":{"const":1},"name":{"const":"model-benchmark/functional-v1-dry-launch-qualification"},"sha256":{"pattern":"^schema:sha256:[0-9a-f]{64}$","type":"string"},"version":{"const":1}},"required":["canonicalization_sha256","canonicalization_version","name","sha256","version"],"type":"object"},"schema_version":{"const":1},"sealed_at_utc":{"pattern":"^20[0-9]{2}-[01][0-9]-[0-3][0-9]T[0-2][0-9]:[0-5][0-9]:[0-5][0-9](?:\\.[0-9]{1,6})?Z$","type":"string"},"summary":{"additionalProperties":false,"properties":{"cleanup_complete":{"const":true},"invalid_infrastructure":{"const":0},"invalid_integrity":{"const":0},"run_record_created":{"const":false},"sealed_bundles":{"const":16},"task_success_required":{"const":false},"terminal_lifecycles":{"const":16}},"required":["cleanup_complete","invalid_infrastructure","invalid_integrity","run_record_created","sealed_bundles","task_success_required","terminal_lifecycles"],"type":"object"}},"required":["catalog_validation","cells","execution","local_provider","network","schema","schema_version","sealed_at_utc","summary"],"type":"object","x-model-benchmark-schema-name":"model-benchmark/functional-v1-dry-launch-qualification","x-model-benchmark-schema-version":1}