{"catalog_validation":{"catalog_document_sha256":"sha256:630eeb477845971d1fdfcf8d3c00a517eb0152c3c648c256388ddeb98d516e5f","manifests":[{"base_url":"https://opencode.ai/zen/go/v1","catalog_input_usd_per_million_tokens":"0.14","catalog_output_usd_per_million_tokens":"0.28","effective_from_utc":"2026-07-22T00:00:00Z","effective_until_utc":"2026-09-01T00:00:00Z","live_route_status":404,"manifest":"functional-v1-manifest.yaml","manifest_identity":"functional-v1-manifest:sha256:9bfe59f32209b9a68d008a749aaac112d5e151e7f8522e1e2e59867903af7aae","model":"deepseek-v4-flash","pricing_identity":"pricing-record:sha256:0fc88e27621746b01950cc08be544ab9714204fe23f1915a7082c09711930fc7","resolved_manifest_identity":"resolved-v1-manifest:sha256:da3d463845a935f88dcfb2207abab85c7e3c5948feb49fcab9fe51875fa79475","source_yaml_sha256":"sha256:b3a32d5f2d4232bebadc924105b4040f09bcc97994eb9d81070d325573a52de3","status":"passed"},{"base_url":"https://opencode.ai/zen/go/v1","catalog_input_usd_per_million_tokens":"0.14","catalog_output_usd_per_million_tokens":"0.28","effective_from_utc":"2026-07-22T00:00:00Z","effective_until_utc":"2026-09-01T00:00:00Z","live_route_status":404,"manifest":"functional-v1-mimo-v2.5.yaml","manifest_identity":"functional-v1-manifest:sha256:83aec8cfca269129799948644d23e84b1a5380f66ae39dfe9aeed5ca619b1b3b","model":"mimo-v2.5","pricing_identity":"pricing-record:sha256:0fc88e27621746b01950cc08be544ab9714204fe23f1915a7082c09711930fc7","resolved_manifest_identity":"resolved-v1-manifest:sha256:f13d9b380153f30ef7de7179178be7a79f8b883deb9625674c50e505695c00a6","source_yaml_sha256":"sha256:ad49831872700dd3927cd4495ed96054eb859aa49a19e05d19eb4a2397bad015","status":"passed"},{"base_url":"https://opencode.ai/zen/go/v1","catalog_input_usd_per_million_tokens":"0.3","catalog_output_usd_per_million_tokens":"1.2","effective_from_utc":"2026-07-22T00:00:00Z","effective_until_utc":"2026-09-01T00:00:00Z","live_route_status":404,"manifest":"functional-v1-minimax-m3.yaml","manifest_identity":"functional-v1-manifest:sha256:2453dbdad9a5b5203fbe99af70423fe085d2cac0bfdcd88d097774d8f64ba8f2","model":"minimax-m3","pricing_identity":"pricing-record:sha256:5af2bdabfcc0b7e2c7b26da13b78e90dfa852b252d719e0c92ae12542f0c4d83","resolved_manifest_identity":"resolved-v1-manifest:sha256:3cb8daff85d6e236af4176f91c91a3d26079678bbea0cddc91cd06efd08c83fa","source_yaml_sha256":"sha256:7d1387be0b5470fd4d37fd38fc2e02e3e1683c92850806c482cf578f52099ad0","status":"passed"},{"base_url":"https://opencode.ai/zen/go/v1","catalog_input_usd_per_million_tokens":"0.14","catalog_output_usd_per_million_tokens":"0.58","effective_from_utc":"2026-07-22T00:00:00Z","effective_until_utc":"2026-09-01T00:00:00Z","live_route_status":404,"manifest":"functional-v1-hy3.yaml","manifest_identity":"functional-v1-manifest:sha256:f0a304c15066b1db44faa0073231b82a4be48981f1f1f29d9376789bfb636986","model":"hy3","pricing_identity":"pricing-record:sha256:839345de1c365754df4745dcffec03b98a3102723bfe4926273401478557afea","resolved_manifest_identity":"resolved-v1-manifest:sha256:167eba54c4f0d9ab473c1bcf4626dfece9f15d7d794de1a5ccca4bf44f558fba","source_yaml_sha256":"sha256:ad99570fdfb4cd535ca86a22abbaf8def59afd668dd44ed000a430a0d017c984","status":"passed"}],"provider_id":"opencode-go","retrieved_at_utc":"2026-07-23T01:53:17.362168Z","schema_version":1,"source_url":"https://models.dev/api.json","status":"passed"},"cells":[{"cell_id":"01-python-sales-by-genre-omp","condition":"omp","disposition":"valid_completed","evidence_valid":true,"lifecycle":{"bundle_sealed":true,"cleanup_complete":true,"condition_exited":true,"condition_started":true,"proxy_request_observed":true,"trusted_submission_capture":true,"verifier_completed":true},"provider_requests":1,"provider_tokens":2,"reason_code":"verifier-completed-no-op","result_bundle_identity":"result-bundle:sha256:92fe8a5ab7359011affb48cc366071cef8057483b23b0c529c19276b56895d84","scenario":"python-sales-by-genre","terminal_phase":"verification"},{"cell_id":"02-python-sales-by-genre-opencode","condition":"opencode","disposition":"valid_completed","evidence_valid":true,"lifecycle":{"bundle_sealed":true,"cleanup_complete":true,"condition_exited":true,"condition_started":true,"proxy_request_observed":true,"trusted_submission_capture":true,"verifier_completed":true},"provider_requests":2,"provider_tokens":4,"reason_code":"verifier-completed-no-op","result_bundle_identity":"result-bundle:sha256:d0e917d2fb13834a50c7d855e896b6771b84af43d8e9cb4c7d9d81e7326ff246","scenario":"python-sales-by-genre","terminal_phase":"verification"},{"cell_id":"03-python-sales-by-genre-hermes","condition":"hermes","disposition":"valid_completed","evidence_valid":true,"lifecycle":{"bundle_sealed":true,"cleanup_complete":true,"condition_exited":true,"condition_started":true,"proxy_request_observed":true,"trusted_submission_capture":true,"verifier_completed":true},"provider_requests":1,"provider_tokens":2,"reason_code":"verifier-completed-no-op","result_bundle_identity":"result-bundle:sha256:d61251188c31c8d650cc81842a08840539872a459ac89a05b1f325167311586d","scenario":"python-sales-by-genre","terminal_phase":"verification"},{"cell_id":"04-python-sales-by-genre-raw-api","condition":"raw-api","disposition":"valid_completed","evidence_valid":true,"lifecycle":{"bundle_sealed":true,"cleanup_complete":true,"condition_exited":true,"condition_started":true,"proxy_request_observed":true,"trusted_submission_capture":true,"verifier_completed":true},"provider_requests":1,"provider_tokens":2,"reason_code":"verifier-completed-no-op","result_bundle_identity":"result-bundle:sha256:c02b4d5d6bf9c4f9dc0f95ef9e2de15fa48c784ba2496aed8808d5bad733c26d","scenario":"python-sales-by-genre","terminal_phase":"verification"},{"cell_id":"05-spring-petvalidator-whitespace-omp","condition":"omp","disposition":"valid_completed","evidence_valid":true,"lifecycle":{"bundle_sealed":true,"cleanup_complete":true,"condition_exited":true,"condition_started":true,"proxy_request_observed":true,"trusted_submission_capture":true,"verifier_completed":true},"provider_requests":1,"provider_tokens":2,"reason_code":"verifier-completed-no-op","result_bundle_identity":"result-bundle:sha256:c7703dcc373262fb71e3654f62d6453d6918300b6ed992fedc93cd4da6056e0d","scenario":"spring-petvalidator-whitespace","terminal_phase":"verification"},{"cell_id":"06-spring-petvalidator-whitespace-opencode","condition":"opencode","disposition":"valid_completed","evidence_valid":true,"lifecycle":{"bundle_sealed":true,"cleanup_complete":true,"condition_exited":true,"condition_started":true,"proxy_request_observed":true,"trusted_submission_capture":true,"verifier_completed":true},"provider_requests":2,"provider_tokens":4,"reason_code":"verifier-completed-no-op","result_bundle_identity":"result-bundle:sha256:72622c3d93bc68ad2dd4766b2fbdb4673d6198e5444b1fcea1b72e40bd5ad5ca","scenario":"spring-petvalidator-whitespace","terminal_phase":"verification"},{"cell_id":"07-spring-petvalidator-whitespace-hermes","condition":"hermes","disposition":"valid_completed","evidence_valid":true,"lifecycle":{"bundle_sealed":true,"cleanup_complete":true,"condition_exited":true,"condition_started":true,"proxy_request_observed":true,"trusted_submission_capture":true,"verifier_completed":true},"provider_requests":1,"provider_tokens":2,"reason_code":"verifier-completed-no-op","result_bundle_identity":"result-bundle:sha256:85d6a66a2760a670eefa3d9c67245417b9810395cb9e3f2d7669ecb5783d9a72","scenario":"spring-petvalidator-whitespace","terminal_phase":"verification"},{"cell_id":"08-spring-petvalidator-whitespace-raw-api","condition":"raw-api","disposition":"valid_completed","evidence_valid":true,"lifecycle":{"bundle_sealed":true,"cleanup_complete":true,"condition_exited":true,"condition_started":true,"proxy_request_observed":true,"trusted_submission_capture":true,"verifier_completed":true},"provider_requests":1,"provider_tokens":2,"reason_code":"verifier-completed-no-op","result_bundle_identity":"result-bundle:sha256:7f1753e1999bd35909380f2fc950d6242f000d6af8c130cebbb0430f5d5ec9bb","scenario":"spring-petvalidator-whitespace","terminal_phase":"verification"},{"cell_id":"09-angular-reading-time-omp","condition":"omp","disposition":"valid_completed","evidence_valid":true,"lifecycle":{"bundle_sealed":true,"cleanup_complete":true,"condition_exited":true,"condition_started":true,"proxy_request_observed":true,"trusted_submission_capture":true,"verifier_completed":true},"provider_requests":1,"provider_tokens":2,"reason_code":"verifier-completed-no-op","result_bundle_identity":"result-bundle:sha256:87a8fa65a4d57c2dcea8b1c5567e41ed2de05df048245bb4fddfbdc8f190e39e","scenario":"angular-reading-time","terminal_phase":"verification"},{"cell_id":"10-angular-reading-time-opencode","condition":"opencode","disposition":"valid_completed","evidence_valid":true,"lifecycle":{"bundle_sealed":true,"cleanup_complete":true,"condition_exited":true,"condition_started":true,"proxy_request_observed":true,"trusted_submission_capture":true,"verifier_completed":true},"provider_requests":2,"provider_tokens":4,"reason_code":"verifier-completed-no-op","result_bundle_identity":"result-bundle:sha256:90e9a6377d994f578255785948c654a0e6d11c522550cec713e20a55ec9c27b4","scenario":"angular-reading-time","terminal_phase":"verification"},{"cell_id":"11-angular-reading-time-hermes","condition":"hermes","disposition":"valid_completed","evidence_valid":true,"lifecycle":{"bundle_sealed":true,"cleanup_complete":true,"condition_exited":true,"condition_started":true,"proxy_request_observed":true,"trusted_submission_capture":true,"verifier_completed":true},"provider_requests":1,"provider_tokens":2,"reason_code":"verifier-completed-no-op","result_bundle_identity":"result-bundle:sha256:a8095d015d88e1a3015a91a11f8aa52d6f22b41b6547179cdcca77ea4a874b86","scenario":"angular-reading-time","terminal_phase":"verification"},{"cell_id":"12-angular-reading-time-raw-api","condition":"raw-api","disposition":"valid_completed","evidence_valid":true,"lifecycle":{"